{
  "name": "smart-ralph",
  "owner": {
    "name": "tzachbon"
  },
  "metadata": {
    "description": "Spec-driven development with dependency-aware task execution via Beads"
  },
  "plugins": [
    {
      "name": "ralph-specum",
      "description": "Spec-driven development with dependency-aware task execution via Beads. Research, requirements, design, tasks, and autonomous execution with fresh context per task.",
      "version": "3.0.0",
      "author": {
        "name": "tzachbon"
      },
      "source": "./plugins/ralph-specum",
      "category": "development",
      "tags": ["ralph", "spec-driven", "autonomous", "research", "tasks", "beads", "dependency-aware"]
    }
  ]
}
